{
  "arm_id": "droste-terra-luna-browsecomp-plus-1k",
  "benchmark_id": "browsecomp-plus-1k",
  "cost_microusd": 137633,
  "droste_commit": "75354f3c10736d6fac517cd8e5955d62865ee845",
  "error": null,
  "iterations": 5,
  "manifest_sha256": "2bc0a0010299db07fb7366c76dd7b1fa5c734859da31332ca63a3e7b0a635cba",
  "metric": "exact_match",
  "prediction": "Stephan Weyte",
  "price_table_version": "modelrelay-pricing-sha256:3c92ae36dcb9e498e885d213e9029e82132f00235da1c4b46b919e5e23aed61b",
  "provider": "openai",
  "reference": "Stephan Weyte",
  "root_model": "gpt-5.6-terra",
  "schema_version": 1,
  "score": 1.0,
  "started_at": "2026-07-18T02:21:33.243878Z",
  "status": "ok",
  "subcall_model": "gpt-5.6-luna",
  "subcalls": 1,
  "suite_id": "rlm-paper",
  "suite_version": "0.2.0",
  "task_id": "1204",
  "usage": {
    "root_input_tokens": 30130,
    "root_output_tokens": 4143,
    "subcall_input_tokens": 115,
    "subcall_output_tokens": 8,
    "total_tokens": 34396
  },
  "wall_time_ms": 49294
}
