{
  "arm_id": "droste-terra-luna-sniah",
  "benchmark_id": "s-niah",
  "cost_microusd": 11873,
  "droste_commit": "7f223b457a3a2ba991250d99ed787338b682378c",
  "error": null,
  "iterations": 2,
  "manifest_sha256": "67f7d6494c783e7d24cb9b44634d2a9656d42a5c278ba50362c4135c8e78d563",
  "metric": "exact_match",
  "prediction": "faint-harbor",
  "price_table_version": "modelrelay-pricing-sha256:3c92ae36dcb9e498e885d213e9029e82132f00235da1c4b46b919e5e23aed61b",
  "provider": "openai",
  "reference": "faint-harbor",
  "root_model": "gpt-5.6-terra",
  "schema_version": 1,
  "score": 1.0,
  "started_at": "2026-07-17T23:31:26.813425Z",
  "status": "ok",
  "subcall_model": "gpt-5.6-luna",
  "subcalls": 0,
  "suite_id": "rlm-paper",
  "suite_version": "0.2.0",
  "task_id": "sniah-010",
  "usage": {
    "root_input_tokens": 2727,
    "root_output_tokens": 337,
    "subcall_input_tokens": 0,
    "subcall_output_tokens": 0,
    "total_tokens": 3064
  },
  "wall_time_ms": 4258
}
