{
  "arm_id": "droste-terra-luna",
  "benchmark_id": "oolong",
  "cost_microusd": 261167,
  "droste_commit": "633954b9f1bc366d9f811c2f11b0ce2c014b1a12",
  "error": null,
  "iterations": 4,
  "manifest_sha256": "edef976a55b2ef35d436d28a25d140f02c736faa30093af753ed8ce7aff82b1c",
  "metric": "oolong_official",
  "prediction": "Answer: entity is more common than human being",
  "price_table_version": "modelrelay-pricing-sha256:3c92ae36dcb9e498e885d213e9029e82132f00235da1c4b46b919e5e23aed61b",
  "provider": "openai",
  "reference": {
    "answer": "['more common than']",
    "answer_type": "ANSWER_TYPE.COMPARISON"
  },
  "root_model": "gpt-5.6-terra",
  "schema_version": 1,
  "score": 1.0,
  "started_at": "2026-07-17T21:22:07.533808Z",
  "status": "ok",
  "subcall_model": "gpt-5.6-luna",
  "subcalls": 32,
  "suite_id": "rlm-paper",
  "suite_version": "0.5.0",
  "task_id": "17000213",
  "usage": {
    "root_input_tokens": 14347,
    "root_output_tokens": 1458,
    "subcall_input_tokens": 48965,
    "subcall_output_tokens": 25744,
    "total_tokens": 90514
  },
  "wall_time_ms": 30687
}
