{
  "arm_id": "direct-terra-sniah",
  "benchmark_id": "s-niah",
  "cost_microusd": 77895,
  "droste_commit": "7f223b457a3a2ba991250d99ed787338b682378c",
  "error": null,
  "iterations": 1,
  "manifest_sha256": "67f7d6494c783e7d24cb9b44634d2a9656d42a5c278ba50362c4135c8e78d563",
  "metric": "exact_match",
  "prediction": "cool-quartz",
  "price_table_version": "modelrelay-pricing-sha256:ceefd1c2eb37f66cde04cf07beeb958f7b0254914b3a19c107bb65ec87bb2d28",
  "provider": "openai",
  "reference": "cool-quartz",
  "root_model": "gpt-5.6-terra",
  "schema_version": 1,
  "score": 1.0,
  "started_at": "2026-07-17T23:29:43.343075Z",
  "status": "ok",
  "subcall_model": null,
  "subcalls": 0,
  "suite_id": "rlm-paper",
  "suite_version": "0.2.0",
  "task_id": "sniah-012",
  "usage": {
    "root_input_tokens": 31116,
    "root_output_tokens": 7,
    "subcall_input_tokens": 0,
    "subcall_output_tokens": 0,
    "total_tokens": 31123
  },
  "wall_time_ms": 2617
}
