{
  "arm_id": "droste-terra-luna-browsecomp-plus-1k",
  "benchmark_id": "browsecomp-plus-1k",
  "cost_microusd": 99995,
  "droste_commit": "75354f3c10736d6fac517cd8e5955d62865ee845",
  "error": null,
  "iterations": 5,
  "manifest_sha256": "2bc0a0010299db07fb7366c76dd7b1fa5c734859da31332ca63a3e7b0a635cba",
  "metric": "exact_match",
  "prediction": "Narendra Modi Stadium, Ahmedabad (formerly Motera/Sardar Patel Stadium).",
  "price_table_version": "modelrelay-pricing-sha256:3c92ae36dcb9e498e885d213e9029e82132f00235da1c4b46b919e5e23aed61b",
  "provider": "openai",
  "reference": "Narender Modi Stadium",
  "root_model": "gpt-5.6-terra",
  "schema_version": 1,
  "score": 0.0,
  "started_at": "2026-07-18T17:07:20.815349Z",
  "status": "ok",
  "subcall_model": "gpt-5.6-luna",
  "subcalls": 1,
  "suite_id": "rlm-paper",
  "suite_version": "0.2.0",
  "task_id": "916",
  "usage": {
    "root_input_tokens": 13658,
    "root_output_tokens": 4338,
    "subcall_input_tokens": 390,
    "subcall_output_tokens": 65,
    "total_tokens": 18451
  },
  "wall_time_ms": 53519
}
