{
  "arm_id": "droste-terra-luna",
  "benchmark_id": "longbench-v2-codeqa",
  "cost_microusd": 128104,
  "droste_commit": "7b60637b0ffff04050bcaa9080178ecf0b9cbe4b",
  "error": null,
  "iterations": 5,
  "manifest_sha256": "868add78edb8ab7b03d045ae0cc17060e2ebd6435240c7602c7b57cc67a81a7b",
  "metric": "exact_match",
  "prediction": "A",
  "price_table_version": "modelrelay-pricing-sha256:3c92ae36dcb9e498e885d213e9029e82132f00235da1c4b46b919e5e23aed61b",
  "provider": "openai",
  "reference": "A",
  "root_model": "gpt-5.6-terra",
  "schema_version": 1,
  "score": 1.0,
  "started_at": "2026-07-18T01:05:30.436548Z",
  "status": "ok",
  "subcall_model": "gpt-5.6-luna",
  "subcalls": 1,
  "suite_id": "rlm-paper",
  "suite_version": "0.2.0",
  "task_id": "66f908e3bb02136c067c4992",
  "usage": {
    "root_input_tokens": 45924,
    "root_output_tokens": 770,
    "subcall_input_tokens": 1186,
    "subcall_output_tokens": 93,
    "total_tokens": 47973
  },
  "wall_time_ms": 13541
}
