{
  "arm_id": "direct-sol-sniah",
  "benchmark_id": "s-niah",
  "cost_microusd": 155850,
  "droste_commit": "7f223b457a3a2ba991250d99ed787338b682378c",
  "error": null,
  "iterations": 1,
  "manifest_sha256": "67f7d6494c783e7d24cb9b44634d2a9656d42a5c278ba50362c4135c8e78d563",
  "metric": "exact_match",
  "prediction": "faint-zephyr.",
  "price_table_version": "modelrelay-pricing-sha256:cb03c5390d3bcc5233d080b9067b08896b250349c0ad084169e3534fcfc8e34c",
  "provider": "openai",
  "reference": "faint-zephyr",
  "root_model": "gpt-5.6-sol",
  "schema_version": 1,
  "score": 0.0,
  "started_at": "2026-07-17T23:28:10.125179Z",
  "status": "ok",
  "subcall_model": null,
  "subcalls": 0,
  "suite_id": "rlm-paper",
  "suite_version": "0.2.0",
  "task_id": "sniah-014",
  "usage": {
    "root_input_tokens": 31116,
    "root_output_tokens": 9,
    "subcall_input_tokens": 0,
    "subcall_output_tokens": 0,
    "total_tokens": 31125
  },
  "wall_time_ms": 2300
}
