{
  "arm_id": "direct-terra",
  "benchmark_id": "oolong",
  "cost_microusd": 240565,
  "droste_commit": "633954b9f1bc366d9f811c2f11b0ce2c014b1a12",
  "error": null,
  "iterations": 1,
  "manifest_sha256": "edef976a55b2ef35d436d28a25d140f02c736faa30093af753ed8ce7aff82b1c",
  "metric": "oolong_official",
  "prediction": "Answer: numeric value is more common than location",
  "price_table_version": "modelrelay-pricing-sha256:ceefd1c2eb37f66cde04cf07beeb958f7b0254914b3a19c107bb65ec87bb2d28",
  "provider": "openai",
  "reference": {
    "answer": "['more common than']",
    "answer_type": "ANSWER_TYPE.COMPARISON"
  },
  "root_model": "gpt-5.6-terra",
  "schema_version": 1,
  "score": 1.0,
  "started_at": "2026-07-17T21:09:05.620121Z",
  "status": "ok",
  "subcall_model": null,
  "subcalls": 0,
  "suite_id": "rlm-paper",
  "suite_version": "0.5.0",
  "task_id": "17000220",
  "usage": {
    "root_input_tokens": 94324,
    "root_output_tokens": 317,
    "subcall_input_tokens": 0,
    "subcall_output_tokens": 0,
    "total_tokens": 94641
  },
  "wall_time_ms": 5034
}
