{
  "arm_id": "droste-terra-luna",
  "benchmark_id": "oolong",
  "cost_microusd": 283258,
  "droste_commit": "633954b9f1bc366d9f811c2f11b0ce2c014b1a12",
  "error": null,
  "iterations": 5,
  "manifest_sha256": "edef976a55b2ef35d436d28a25d140f02c736faa30093af753ed8ce7aff82b1c",
  "metric": "oolong_official",
  "prediction": "Answer: 503",
  "price_table_version": "modelrelay-pricing-sha256:3c92ae36dcb9e498e885d213e9029e82132f00235da1c4b46b919e5e23aed61b",
  "provider": "openai",
  "reference": {
    "answer": "[571]",
    "answer_type": "ANSWER_TYPE.NUMERIC"
  },
  "root_model": "gpt-5.6-terra",
  "schema_version": 1,
  "score": 3.192757330023075e-09,
  "started_at": "2026-07-17T21:39:53.063288Z",
  "status": "ok",
  "subcall_model": "gpt-5.6-luna",
  "subcalls": 32,
  "suite_id": "rlm-paper",
  "suite_version": "0.5.0",
  "task_id": "17000241",
  "usage": {
    "root_input_tokens": 17622,
    "root_output_tokens": 2511,
    "subcall_input_tokens": 47074,
    "subcall_output_tokens": 25744,
    "total_tokens": 92951
  },
  "wall_time_ms": 34400
}
