{
  "arm_id": "direct-sol",
  "benchmark_id": "longbench-v2-codeqa",
  "cost_microusd": 501965,
  "droste_commit": "4e166e197dd395f28c90b9afa865b93cfcc3613c+worktree.92f1f62095af5377",
  "error": null,
  "iterations": 1,
  "manifest_sha256": "868add78edb8ab7b03d045ae0cc17060e2ebd6435240c7602c7b57cc67a81a7b",
  "metric": "exact_match",
  "prediction": "C",
  "price_table_version": "modelrelay-pricing-sha256:cb03c5390d3bcc5233d080b9067b08896b250349c0ad084169e3534fcfc8e34c",
  "provider": "openai",
  "reference": "C",
  "root_model": "gpt-5.6-sol",
  "schema_version": 1,
  "score": 1.0,
  "started_at": "2026-07-17T23:42:41.403250Z",
  "status": "ok",
  "subcall_model": null,
  "subcalls": 0,
  "suite_id": "rlm-paper",
  "suite_version": "0.2.0",
  "task_id": "66fa700bbb02136c067c6c06",
  "usage": {
    "root_input_tokens": 99529,
    "root_output_tokens": 144,
    "subcall_input_tokens": 0,
    "subcall_output_tokens": 0,
    "total_tokens": 99673
  },
  "wall_time_ms": 4692
}
