{
  "arm_id": "direct-sol-browsecomp-plus-1k",
  "benchmark_id": "browsecomp-plus-1k",
  "cost_microusd": 0,
  "droste_commit": "75354f3c10736d6fac517cd8e5955d62865ee845",
  "error": "root llm failed with HTTP 400: {\"error\":\"api_error\",\"request_id\":\"a228d4d1-baf9-4131-80e8-dc39ab459b93\",\"layer\":\"request\",\"cause\":\"validation\",\"status_code\":400,\"code\":\"INVALID_INPUT\",\"message\":\"invalid payload\",\"retryable\":false}",
  "iterations": 1,
  "manifest_sha256": "2bc0a0010299db07fb7366c76dd7b1fa5c734859da31332ca63a3e7b0a635cba",
  "metric": "exact_match",
  "prediction": null,
  "price_table_version": "modelrelay-pricing-sha256:cb03c5390d3bcc5233d080b9067b08896b250349c0ad084169e3534fcfc8e34c",
  "provider": "openai",
  "reference": "Oral creatine supplementation: A potential adjunct therapy for rheumatoid arthritis patients",
  "root_model": "gpt-5.6-sol",
  "schema_version": 1,
  "score": null,
  "started_at": "2026-07-18T01:22:37.792270Z",
  "status": "context_limit",
  "subcall_model": null,
  "subcalls": 0,
  "suite_id": "rlm-paper",
  "suite_version": "0.2.0",
  "task_id": "792",
  "usage": {
    "root_input_tokens": 0,
    "root_output_tokens": 0,
    "subcall_input_tokens": 0,
    "subcall_output_tokens": 0,
    "total_tokens": 0
  },
  "wall_time_ms": 7119
}
